{
  "title": "示例视频：初秋街角的花店橱窗",
  "headline": "示例视频：初秋街角的花店橱窗",
  "content_text": "周末路过常去的花店，新换的橱窗配色太舒服了，随手记录一下。",
  "subtitle": "抖音 · 视频",
  "source_label": "视频",
  "platform": "抖音",
  "service": "视频",
  "category": "视频",
  "author": {
    "name": "RayleaBot 示例用户",
    "avatar": "assets/douyin-default-avatar.svg",
    "uid": "MS4wLjABAAAApreview"
  },
  "author_uid_text": "UID MS4wLjABAAAApreview",
  "summary": "周末路过常去的花店，新换的橱窗配色太舒服了，随手记录一下。",
  "images": [
    {
      "url": "assets/cover.svg",
      "width": 1280,
      "height": 720
    }
  ],
  "image_count": 1,
  "media_grid_class": "media-grid--single",
  "media_items": [
    {
      "url": "assets/cover.svg",
      "class": "media-item media-item--wide media-item--video",
      "label": "",
      "duration_text": "01:20",
      "width": 1280,
      "height": 720,
      "fallback": "assets/cover.svg"
    }
  ],
  "metrics": [
    { "key": "play", "label": "播放", "value": 1286000, "value_text": "128.6万", "icon_class": "metric-icon--play" },
    { "key": "like", "label": "点赞", "value": 96000, "value_text": "9.6万", "icon_class": "metric-icon--like" },
    { "key": "favorite", "label": "收藏", "value": 68000, "value_text": "6.8万", "icon_class": "metric-icon--favorite" },
    { "key": "comment", "label": "评论", "value": 8600, "value_text": "8600", "icon_class": "metric-icon--comment" },
    { "key": "share", "label": "分享", "value": 12000, "value_text": "1.2万", "icon_class": "metric-icon--share" }
  ],
  "duration_text": "01:20",
  "url": "https://www.douyin.com/video/7000000000000000000",
  "pub_ts": 1778342400,
  "created_at": "2026年05月09日 20:00",
  "subscription": {
    "uid": "MS4wLjABAAAApreview",
    "name": "RayleaBot 示例用户"
  },
  "subscribers": [
    {
      "id": "10001",
      "nickname": "普通昵称",
      "group_nickname": "群昵称",
      "title": "专属头衔",
      "role": "admin",
      "role_label": "管理员",
      "avatar_url": "https://q1.qlogo.cn/g?b=qq&nk=10001&s=100"
    },
    {
      "id": "10002",
      "nickname": "旧订阅人"
    }
  ],
  "subscriber_cards": [
    {
      "id": "10001",
      "nickname": "普通昵称",
      "group_nickname": "群昵称",
      "display_name": "群昵称",
      "title": "专属头衔",
      "role": "admin",
      "role_label": "管理员",
      "avatar_url": "https://q1.qlogo.cn/g?b=qq&nk=10001&s=100",
      "uid_text": "10001"
    },
    {
      "id": "10002",
      "nickname": "旧订阅人",
      "group_nickname": "",
      "display_name": "旧订阅人",
      "title": "",
      "role": "",
      "role_label": "",
      "avatar_url": "https://q1.qlogo.cn/g?b=qq&nk=10002&s=100",
      "uid_text": "10002"
    }
  ],
  "subscriber_text": "群昵称、旧订阅人"
}
